{
  "schema_version": "0.1.0",
  "review_id": "ai-会议助手第一版-engineering-review",
  "generated_at": "2026-03-20T19:11:28+00:00",
  "title": "AI 会议助手第一版",
  "brief_id": "ai-会议助手第一版",
  "product_review_id": "ai-会议助手第一版-product-review",
  "change_goal": "只修删除误删链路，不顺手扩成一次存储层重构",
  "write_boundary": [
    "src/meeting_assistant.py",
    "src/calendar_agent.py",
    "src/event_store.py"
  ],
  "avoid_files": [
    "AGENTS.md",
    "README.md"
  ],
  "state_owner": "meeting_assistant",
  "candidate_files": [
    {
      "path": "AGENTS.md",
      "language": "markdown",
      "role": "documentation",
      "score": 7,
      "reason": "High-signal documentation file"
    },
    {
      "path": "README.md",
      "language": "markdown",
      "role": "documentation",
      "score": 7,
      "reason": "High-signal documentation file"
    },
    {
      "path": "pyproject.toml",
      "language": "toml",
      "role": "configuration",
      "score": 6,
      "reason": "High-signal configuration file"
    },
    {
      "path": "src/meeting_assistant.py",
      "language": "python",
      "role": "source",
      "score": 6,
      "reason": "High-signal source file"
    },
    {
      "path": "src/calendar_agent.py",
      "language": "python",
      "role": "source",
      "score": 4,
      "reason": "High-signal source file"
    },
    {
      "path": "src/event_store.py",
      "language": "python",
      "role": "source",
      "score": 3,
      "reason": "High-signal source file"
    },
    {
      "path": "src/ui_state.py",
      "language": "python",
      "role": "source",
      "score": 3,
      "reason": "High-signal source file"
    },
    {
      "path": ".aidrpignore",
      "language": "text",
      "role": "source",
      "score": 2,
      "reason": "High-signal source file"
    },
    {
      "path": "logs/runtime.log",
      "language": "text",
      "role": "source",
      "score": 2,
      "reason": "High-signal source file"
    }
  ],
  "risk_points": [
    "选择器、可见顺序或稳定 ID 不一致时，可能删除错误对象。",
    "关键编号没有透传到日志时，排障会退化成大范围扫描。"
  ],
  "failure_modes": [
    "删除确认的是 A，但执行器真正删掉的是 B。",
    "操作完成了，但日志里缺少 trace / decision / plan / tool call 编号。",
    "代码修通了 happy path，但真实入口仍然复现旧问题。"
  ],
  "observability_points": [
    "在入口、计划确认、执行器三个边界记录 trace_id / decision_id / plan_id / tool_call_id。",
    "日志里同时记录 expected target 和 actual target，避免只看到“成功/失败”而不知道删的是谁。",
    "删除链路必须记录 selection_id、stable_id 和最终写入目标。"
  ],
  "validation_commands": [
    "meeting-demo",
    "python -m unittest discover -s tests -v"
  ],
  "live_qa_entry": "通过聊天创建、改期和删除会议",
  "rollback_plan": "如果真实验收或日志编号链路不稳定，就回到上一个可验证版本，并保留这次决策轨迹。",
  "review_decision": "ready",
  "review_decision_label": "可以开工",
  "decision_reason": "写入边界、风险、日志观察点和验证方式已经足够清楚",
  "recommended_artifacts": [
    {
      "artifact": "domain-map",
      "required": true,
      "reason": "场景开始跨多个业务域时，需要先明确状态归属和编排关系。"
    },
    {
      "artifact": "tool-contract",
      "required": true,
      "reason": "一旦进入工具调用和执行器阶段，就要明确输入、输出、失败语义和权限边界。"
    },
    {
      "artifact": "execution-plan",
      "required": true,
      "reason": "涉及多步确认或批量动作时，计划与执行分离能显著减少返工和慢循环。"
    },
    {
      "artifact": "observability-correlation",
      "required": true,
      "reason": "只要排障可能依赖编号和日志，就应该尽早接入关联定位。"
    },
    {
      "artifact": "cost-privacy-budget",
      "required": false,
      "reason": "AI 原生产品只要要长期运行，就要提前约束上下文、权限和敏感数据暴露范围。"
    }
  ],
  "recommended_next_step": "写 task-packet 或 debug-pack；如果评审结论不是 ready，就先缩范围或补信息。"
}
